{
  "artifact_type": "racketsport_ball_human_label_set",
  "calibration_evidence": {
    "metric_confidence": "med",
    "note": "plane_residual_check is this clip's measured bounce accuracy floor: even a perfect click inherits it. It is the sigma floor for every bounce label.",
    "plane_residual_check": {
      "available": true,
      "max_m": 0.447483,
      "median_m": 0.100551,
      "method": "pixel_ray_world -> intersect_ray_z(z=0) on the calibration's own reviewed correspondences, compared to their known world positions",
      "note": "This is the court-plane accuracy floor a perfect bounce click still inherits from this clip's calibration. Bounce label sigma is floored at the median.",
      "p95_m": 0.434946,
      "point_count": 15
    },
    "reprojection_error_px": {
      "median": 4.7835,
      "p95": 12.276624
    },
    "sha256": "bb7bb05b55af2799f49308be6e5b5e5b184af4862c1de8efe05e794f71e8dbd9",
    "source": "metric_15pt_reviewed"
  },
  "clip_id": "outdoor_webcam_20s_fullmesh_final",
  "fps": 30.0,
  "frame_count": 600,
  "generated_by": "scripts/racketsport/ball_label_studio.py",
  "human_reviewed": true,
  "image_size": [
    1920,
    1080
  ],
  "labels": [
    {
      "accuracy_tier": "player_referenced",
      "depth_along_ray_m": 28.8799,
      "depth_source": "human_drag",
      "frame": 63,
      "human_confidence": "medium",
      "is_ground_truth_candidate": false,
      "kind": "near_player",
      "label_id": "f000063",
      "near_player": {
        "depth_along_ray_m": 28.8799,
        "joint_confidence": 0.891,
        "joint_index": 10,
        "joint_name": "right_hip",
        "joint_world_m": [
          -1.2601,
          7.855,
          0.8777
        ],
        "offset_from_ray_m": 0.0388,
        "player_id": 3
      },
      "notes": "",
      "origin": "fresh",
      "pixel_xy": [
        839.107178,
        224.12854
      ],
      "prefill": null,
      "ray_direction_unit": [
        -0.042786,
        0.99036,
        -0.13174
      ],
      "ray_origin_m": [
        -0.063174,
        -20.748474,
        4.680527
      ],
      "sigma_along_ray_m": 0.50776,
      "sigma_perp_m": 0.022759,
      "sigma_xyz_m": [
        0.031448,
        0.502875,
        0.070594
      ],
      "timestamp_s": 2.1,
      "uncertainty_basis": "human depth judgement against a tracked player joint 0.04 m off the ray; prior 0.5 m widened by the off-ray offset. This is a human estimate, not a measurement.",
      "world_xyz_m": [
        -1.29883,
        7.853036,
        0.875876
      ]
    },
    {
      "accuracy_tier": "player_referenced",
      "depth_along_ray_m": 28.8963,
      "depth_source": "human_drag",
      "frame": 64,
      "human_confidence": "medium",
      "is_ground_truth_candidate": false,
      "kind": "near_player",
      "label_id": "f000064",
      "near_player": {
        "depth_along_ray_m": 28.8963,
        "joint_confidence": 0.901,
        "joint_index": 10,
        "joint_name": "right_hip",
        "joint_world_m": [
          -1.2606,
          7.8715,
          0.8772
        ],
        "offset_from_ray_m": 0.0628,
        "player_id": 3
      },
      "notes": "",
      "origin": "fresh",
      "pixel_xy": [
        840.0,
        228.75
      ],
      "prefill": null,
      "ray_direction_unit": [
        -0.04245,
        0.990137,
        -0.133518
      ],
      "ray_origin_m": [
        -0.063174,
        -20.748474,
        4.680527
      ],
      "sigma_along_ray_m": 0.51256,
      "sigma_perp_m": 0.022772,
      "sigma_xyz_m": [
        0.031481,
        0.507515,
        0.072061
      ],
      "timestamp_s": 2.133,
      "uncertainty_basis": "human depth judgement against a tracked player joint 0.06 m off the ray; prior 0.5 m widened by the off-ray offset. This is a human estimate, not a measurement.",
      "world_xyz_m": [
        -1.289821,
        7.862815,
        0.82234
      ]
    },
    {
      "accuracy_tier": "unreferenced_estimate",
      "depth_along_ray_m": 28.898184,
      "depth_source": "interpolated_arc",
      "frame": 65,
      "human_confidence": "low",
      "is_ground_truth_candidate": false,
      "kind": "free_flight",
      "label_id": "f000065",
      "near_player": null,
      "notes": "accepted from a ballistic interpolation between frames 64 and 73",
      "origin": "fresh",
      "pixel_xy": [
        835.71,
        223.11
      ],
      "prefill": null,
      "ray_direction_unit": [
        -0.044107,
        0.990356,
        -0.13134
      ],
      "ray_origin_m": [
        -0.063174,
        -20.748474,
        4.680527
      ],
      "sigma_along_ray_m": 2.000003,
      "sigma_perp_m": 0.022773,
      "sigma_xyz_m": [
        0.091101,
        1.980717,
        0.26365
      ],
      "timestamp_s": 2.167,
      "uncertainty_basis": "unreferenced human depth estimate; prior 2 m along the camera ray. No geometric or tracked-object constraint fixes depth here. Do not treat as ground truth. Plus 0.004 m for drag neglected by the interpolated arc.",
      "world_xyz_m": [
        -1.337796,
        7.871004,
        0.885027
      ]
    },
    {
      "accuracy_tier": "unreferenced_estimate",
      "depth_along_ray_m": 28.901586,
      "depth_source": "interpolated_arc",
      "frame": 66,
      "human_confidence": "low",
      "is_ground_truth_candidate": false,
      "kind": "free_flight",
      "label_id": "f000066",
      "near_player": null,
      "notes": "accepted from a ballistic interpolation between frames 64 and 73",
      "origin": "fresh",
      "pixel_xy": [
        831.56,
        218.6
      ],
      "prefill": null,
      "ray_direction_unit": [
        -0.045712,
        0.990512,
        -0.129597
      ],
      "ray_origin_m": [
        -0.063174,
        -20.748474,
        4.680527
      ],
      "sigma_along_ray_m": 2.000003,
      "sigma_perp_m": 0.022776,
      "sigma_xyz_m": [
        0.094212,
        1.981031,
        0.260177
      ],
      "timestamp_s": 2.2,
      "uncertainty_basis": "unreferenced human depth estimate; prior 2 m along the camera ray. No geometric or tracked-object constraint fixes depth here. Do not treat as ground truth. Plus 0.004 m for drag neglected by the interpolated arc.",
      "world_xyz_m": [
        -1.384318,
        7.878907,
        0.934959
      ]
    },
    {
      "accuracy_tier": "unreferenced_estimate",
      "depth_along_ray_m": 28.906508,
      "depth_source": "interpolated_arc",
      "frame": 67,
      "human_confidence": "low",
      "is_ground_truth_candidate": false,
      "kind": "free_flight",
      "label_id": "f000067",
      "near_player": null,
      "notes": "accepted from a ballistic interpolation between frames 64 and 73",
      "origin": "fresh",
      "pixel_xy": [
        827.43,
        215.03
      ],
      "prefill": null,
      "ray_direction_unit": [
        -0.04731,
        0.990617,
        -0.128216
      ],
      "ray_origin_m": [
        -0.063174,
        -20.748474,
        4.680527
      ],
      "sigma_along_ray_m": 2.000003,
      "sigma_perp_m": 0.02278,
      "sigma_xyz_m": [
        0.097318,
        1.98124,
        0.257425
      ],
      "timestamp_s": 2.233,
      "uncertainty_basis": "unreferenced human depth estimate; prior 2 m along the camera ray. No geometric or tracked-object constraint fixes depth here. Do not treat as ground truth. Plus 0.004 m for drag neglected by the interpolated arc.",
      "world_xyz_m": [
        -1.430741,
        7.886811,
        0.974265
      ]
    },
    {
      "accuracy_tier": "unreferenced_estimate",
      "depth_along_ray_m": 28.913195,
      "depth_source": "interpolated_arc",
      "frame": 68,
      "human_confidence": "low",
      "is_ground_truth_candidate": false,
      "kind": "free_flight",
      "label_id": "f000068",
      "near_player": null,
      "notes": "accepted from a ballistic interpolation between frames 64 and 73",
      "origin": "fresh",
      "pixel_xy": [
        823.17,
        212.35
      ],
      "prefill": null,
      "ray_direction_unit": [
        -0.04896,
        0.990671,
        -0.127175
      ],
      "ray_origin_m": [
        -0.063174,
        -20.748474,
        4.680527
      ],
      "sigma_along_ray_m": 2.000003,
      "sigma_perp_m": 0.022785,
      "sigma_xyz_m": [
        0.100531,
        1.981348,
        0.255353
      ],
      "timestamp_s": 2.267,
      "uncertainty_basis": "unreferenced human depth estimate; prior 2 m along the camera ray. No geometric or tracked-object constraint fixes depth here. Do not treat as ground truth. Plus 0.004 m for drag neglected by the interpolated arc.",
      "world_xyz_m": [
        -1.478777,
        7.894995,
        1.00349
      ]
    },
    {
      "accuracy_tier": "unreferenced_estimate",
      "depth_along_ray_m": 28.921103,
      "depth_source": "interpolated_arc",
      "frame": 69,
      "human_confidence": "low",
      "is_ground_truth_candidate": false,
      "kind": "free_flight",
      "label_id": "f000069",
      "near_player": null,
      "notes": "accepted from a ballistic interpolation between frames 64 and 73",
      "origin": "fresh",
      "pixel_xy": [
        819.06,
        210.7
      ],
      "prefill": null,
      "ray_direction_unit": [
        -0.050555,
        0.990674,
        -0.12653
      ],
      "ray_origin_m": [
        -0.063174,
        -20.748474,
        4.680527
      ],
      "sigma_along_ray_m": 2.000003,
      "sigma_perp_m": 0.022791,
      "sigma_xyz_m": [
        0.10364,
        1.981353,
        0.254069
      ],
      "timestamp_s": 2.3,
      "uncertainty_basis": "unreferenced human depth estimate; prior 2 m along the camera ray. No geometric or tracked-object constraint fixes depth here. Do not treat as ground truth. Plus 0.004 m for drag neglected by the interpolated arc.",
      "world_xyz_m": [
        -1.525274,
        7.9029,
        1.021131
      ]
    },
    {